{
  "catalog_major": 1,
  "catalog_minor": 0,
  "freeze_date": "2026-08-31",
  "providers": [
    "openai",
    "anthropic",
    "vertex"
  ],
  "records": [
    {
      "affinity": "none",
      "capability_tags": [
        "control_plane"
      ],
      "first_supported_version": "v0.2.0",
      "id": "anthropic.get.v1.api_keys",
      "metering_source": "none",
      "method": "GET",
      "official_source": "https://platform.claude.com/docs/en/api/overview",
      "owning_sf": "SF01",
      "path_template": "/v1/api_keys",
      "protocol_version": "v1",
      "provider": "anthropic",
      "requires_project_opt_in": false,
      "stability": "control_plane",
      "stateful": false,
      "test_fixture_version": "fx-v0.2.0",
      "transport": "http"
    },
    {
      "affinity": "none",
      "capability_tags": [
        "control_plane"
      ],
      "first_supported_version": "v0.2.0",
      "id": "anthropic.post.v1.api_keys",
      "metering_source": "none",
      "method": "POST",
      "official_source": "https://platform.claude.com/docs/en/api/overview",
      "owning_sf": "SF01",
      "path_template": "/v1/api_keys",
      "protocol_version": "v1",
      "provider": "anthropic",
      "requires_project_opt_in": false,
      "stability": "control_plane",
      "stateful": false,
      "test_fixture_version": "fx-v0.2.0",
      "transport": "http"
    },
    {
      "affinity": "none",
      "capability_tags": [
        "control_plane"
      ],
      "first_supported_version": "v0.2.0",
      "id": "anthropic.delete.v1.api_keys.api_key_id",
      "metering_source": "none",
      "method": "DELETE",
      "official_source": "https://platform.claude.com/docs/en/api/overview",
      "owning_sf": "SF01",
      "path_template": "/v1/api_keys/{api_key_id}",
      "protocol_version": "v1",
      "provider": "anthropic",
      "requires_project_opt_in": false,
      "stability": "control_plane",
      "stateful": false,
      "test_fixture_version": "fx-v0.2.0",
      "transport": "http"
    },
    {
      "affinity": "resource_id",
      "capability_tags": [],
      "first_supported_version": "v0.2.0",
      "id": "anthropic.get.v1.files",
      "metering_source": "none",
      "method": "GET",
      "official_source": "https://platform.claude.com/docs/en/api/overview",
      "owning_sf": "SF20",
      "path_template": "/v1/files",
      "protocol_version": "v1",
      "provider": "anthropic",
      "requires_project_opt_in": true,
      "stability": "beta",
      "stateful": true,
      "test_fixture_version": "fx-v0.2.0",
      "transport": "http"
    },
    {
      "affinity": "resource_id",
      "capability_tags": [],
      "first_supported_version": "v0.2.0",
      "id": "anthropic.post.v1.files",
      "metering_source": "none",
      "method": "POST",
      "official_source": "https://platform.claude.com/docs/en/api/overview",
      "owning_sf": "SF20",
      "path_template": "/v1/files",
      "protocol_version": "v1",
      "provider": "anthropic",
      "requires_project_opt_in": true,
      "stability": "beta",
      "stateful": true,
      "test_fixture_version": "fx-v0.2.0",
      "transport": "multipart"
    },
    {
      "affinity": "resource_id",
      "capability_tags": [],
      "first_supported_version": "v0.2.0",
      "id": "anthropic.delete.v1.files.file_id",
      "metering_source": "none",
      "method": "DELETE",
      "official_source": "https://platform.claude.com/docs/en/api/overview",
      "owning_sf": "SF20",
      "path_template": "/v1/files/{file_id}",
      "protocol_version": "v1",
      "provider": "anthropic",
      "requires_project_opt_in": true,
      "stability": "beta",
      "stateful": true,
      "test_fixture_version": "fx-v0.2.0",
      "transport": "http"
    },
    {
      "affinity": "resource_id",
      "capability_tags": [],
      "first_supported_version": "v0.2.0",
      "id": "anthropic.get.v1.files.file_id",
      "metering_source": "none",
      "method": "GET",
      "official_source": "https://platform.claude.com/docs/en/api/overview",
      "owning_sf": "SF20",
      "path_template": "/v1/files/{file_id}",
      "protocol_version": "v1",
      "provider": "anthropic",
      "requires_project_opt_in": true,
      "stability": "beta",
      "stateful": true,
      "test_fixture_version": "fx-v0.2.0",
      "transport": "http"
    },
    {
      "affinity": "resource_id",
      "capability_tags": [],
      "first_supported_version": "v0.2.0",
      "id": "anthropic.get.v1.files.file_id.content",
      "metering_source": "none",
      "method": "GET",
      "official_source": "https://platform.claude.com/docs/en/api/overview",
      "owning_sf": "SF20",
      "path_template": "/v1/files/{file_id}/content",
      "protocol_version": "v1",
      "provider": "anthropic",
      "requires_project_opt_in": true,
      "stability": "beta",
      "stateful": true,
      "test_fixture_version": "fx-v0.2.0",
      "transport": "binary"
    },
    {
      "affinity": "none",
      "capability_tags": [
        "control_plane"
      ],
      "first_supported_version": "v0.2.0",
      "id": "anthropic.get.v1.invites",
      "metering_source": "none",
      "method": "GET",
      "official_source": "https://platform.claude.com/docs/en/api/overview",
      "owning_sf": "SF01",
      "path_template": "/v1/invites",
      "protocol_version": "v1",
      "provider": "anthropic",
      "requires_project_opt_in": false,
      "stability": "control_plane",
      "stateful": false,
      "test_fixture_version": "fx-v0.2.0",
      "transport": "http"
    },
    {
      "affinity": "none",
      "capability_tags": [
        "messages",
        "tools"
      ],
      "first_supported_version": "v0.2.0",
      "id": "anthropic.post.v1.messages",
      "metering_source": "mixed",
      "method": "POST",
      "official_source": "https://platform.claude.com/docs/en/api/overview",
      "owning_sf": "SF20",
      "path_template": "/v1/messages",
      "protocol_version": "v1",
      "provider": "anthropic",
      "requires_project_opt_in": false,
      "stability": "stable",
      "stateful": false,
      "test_fixture_version": "fx-v0.2.0",
      "transport": "sse"
    },
    {
      "affinity": "resource_id",
      "capability_tags": [],
      "first_supported_version": "v0.2.0",
      "id": "anthropic.get.v1.messages.batches",
      "metering_source": "none",
      "method": "GET",
      "official_source": "https://platform.claude.com/docs/en/api/overview",
      "owning_sf": "SF20",
      "path_template": "/v1/messages/batches",
      "protocol_version": "v1",
      "provider": "anthropic",
      "requires_project_opt_in": false,
      "stability": "stable",
      "stateful": true,
      "test_fixture_version": "fx-v0.2.0",
      "transport": "http"
    },
    {
      "affinity": "resource_id",
      "capability_tags": [],
      "first_supported_version": "v0.2.0",
      "id": "anthropic.post.v1.messages.batches",
      "metering_source": "mixed",
      "method": "POST",
      "official_source": "https://platform.claude.com/docs/en/api/overview",
      "owning_sf": "SF20",
      "path_template": "/v1/messages/batches",
      "protocol_version": "v1",
      "provider": "anthropic",
      "requires_project_opt_in": false,
      "stability": "stable",
      "stateful": true,
      "test_fixture_version": "fx-v0.2.0",
      "transport": "http"
    },
    {
      "affinity": "resource_id",
      "capability_tags": [],
      "first_supported_version": "v0.2.0",
      "id": "anthropic.delete.v1.messages.batches.message_batch_id",
      "metering_source": "none",
      "method": "DELETE",
      "official_source": "https://platform.claude.com/docs/en/api/overview",
      "owning_sf": "SF20",
      "path_template": "/v1/messages/batches/{message_batch_id}",
      "protocol_version": "v1",
      "provider": "anthropic",
      "requires_project_opt_in": false,
      "stability": "stable",
      "stateful": true,
      "test_fixture_version": "fx-v0.2.0",
      "transport": "http"
    },
    {
      "affinity": "resource_id",
      "capability_tags": [],
      "first_supported_version": "v0.2.0",
      "id": "anthropic.get.v1.messages.batches.message_batch_id",
      "metering_source": "none",
      "method": "GET",
      "official_source": "https://platform.claude.com/docs/en/api/overview",
      "owning_sf": "SF20",
      "path_template": "/v1/messages/batches/{message_batch_id}",
      "protocol_version": "v1",
      "provider": "anthropic",
      "requires_project_opt_in": false,
      "stability": "stable",
      "stateful": true,
      "test_fixture_version": "fx-v0.2.0",
      "transport": "http"
    },
    {
      "affinity": "resource_id",
      "capability_tags": [],
      "first_supported_version": "v0.2.0",
      "id": "anthropic.post.v1.messages.batches.message_batch_id.cancel",
      "metering_source": "none",
      "method": "POST",
      "official_source": "https://platform.claude.com/docs/en/api/overview",
      "owning_sf": "SF20",
      "path_template": "/v1/messages/batches/{message_batch_id}/cancel",
      "protocol_version": "v1",
      "provider": "anthropic",
      "requires_project_opt_in": false,
      "stability": "stable",
      "stateful": true,
      "test_fixture_version": "fx-v0.2.0",
      "transport": "http"
    },
    {
      "affinity": "resource_id",
      "capability_tags": [],
      "first_supported_version": "v0.2.0",
      "id": "anthropic.get.v1.messages.batches.message_batch_id.results",
      "metering_source": "none",
      "method": "GET",
      "official_source": "https://platform.claude.com/docs/en/api/overview",
      "owning_sf": "SF20",
      "path_template": "/v1/messages/batches/{message_batch_id}/results",
      "protocol_version": "v1",
      "provider": "anthropic",
      "requires_project_opt_in": false,
      "stability": "stable",
      "stateful": true,
      "test_fixture_version": "fx-v0.2.0",
      "transport": "binary"